{
  "$schema": "model-migrations.v1.schema.json",
  "schemaVersion": 1,
  "catalogVersion": "2026-11-01",
  "evidenceAsOfDate": "2026-11-01",
  "defaultStrategy": "latestInFamily",
  "authority": {
    "rules": "docs/model-migrations.md",
    "routingPolicy": "docs/system/domains/model-routing-policy.md",
    "priceCatalog": "src/TokenEconomy/catalog/model-prices.json"
  },
  "costClassOrder": [
    "economy",
    "standard",
    "premium"
  ],
  "migrations": [
    {
      "from": "claude-opus-4-8",
      "to": "claude-opus-5-5",
      "family": "claude-opus",
      "vendor": "anthropic",
      "generationOrder": {
        "from": 408,
        "to": 505
      },
      "costClassFrom": "premium",
      "costClassTo": "premium",
      "ladderCompatible": true,
      "contextChange": "unknown",
      "evidence": {
        "kind": "none",
        "reason": "The earlier identical-case benchmark compared this source with Opus 5, not current Opus 5.5; no direct no-regression cohort transfers."
      },
      "safeAuto": false,
      "since": "2026-09-06",
      "note": "Proposal only. Opus 5.5 is the current Opus-line target. Verify API/CLI access, thinking compatibility and identical-case outcomes before changing a pin."
    },
    {
      "from": "claude-opus-4-7",
      "to": "claude-opus-5-5",
      "family": "claude-opus",
      "vendor": "anthropic",
      "generationOrder": {
        "from": 407,
        "to": 505
      },
      "costClassFrom": "premium",
      "costClassTo": "premium",
      "ladderCompatible": true,
      "contextChange": "unknown",
      "evidence": {
        "kind": "none",
        "reason": "The earlier identical-case benchmark compared this source with Opus 5, not current Opus 5.5; no direct no-regression cohort transfers."
      },
      "safeAuto": false,
      "since": "2026-09-06",
      "note": "Proposal only. Opus 5.5 is the current Opus-line target. Verify API/CLI access, thinking compatibility and identical-case outcomes before changing a pin."
    },
    {
      "from": "claude-opus-4-6",
      "to": "claude-opus-5-5",
      "family": "claude-opus",
      "vendor": "anthropic",
      "generationOrder": {
        "from": 406,
        "to": 505
      },
      "costClassFrom": "premium",
      "costClassTo": "premium",
      "ladderCompatible": true,
      "contextChange": "unknown",
      "evidence": {
        "kind": "none",
        "reason": "The earlier identical-case benchmark compared this source with Opus 5, not current Opus 5.5; no direct no-regression cohort transfers."
      },
      "safeAuto": false,
      "since": "2026-09-06",
      "note": "Proposal only. Opus 5.5 is the current Opus-line target. Verify API/CLI access, thinking compatibility and identical-case outcomes before changing a pin."
    },
    {
      "from": "claude-opus-4-5",
      "to": "claude-opus-5-5",
      "family": "claude-opus",
      "vendor": "anthropic",
      "generationOrder": {
        "from": 405,
        "to": 505
      },
      "costClassFrom": "premium",
      "costClassTo": "premium",
      "ladderCompatible": true,
      "contextChange": "unknown",
      "evidence": {
        "kind": "none",
        "reason": "The earlier identical-case benchmark compared this source with Opus 5, not current Opus 5.5; no direct no-regression cohort transfers."
      },
      "safeAuto": false,
      "since": "2026-09-06",
      "note": "Proposal only. Opus 5.5 is the current Opus-line target. Verify API/CLI access, thinking compatibility and identical-case outcomes before changing a pin."
    },
    {
      "from": "claude-sonnet-4-6",
      "to": "claude-sonnet-5-5",
      "family": "claude-sonnet",
      "vendor": "anthropic",
      "generationOrder": {
        "from": 406,
        "to": 505
      },
      "costClassFrom": "standard",
      "costClassTo": "standard",
      "ladderCompatible": true,
      "contextChange": "unknown",
      "evidence": {
        "kind": "none",
        "reason": "The earlier identical-case benchmark compared Sonnet 4.6 with Sonnet 5, not current Sonnet 5.5."
      },
      "safeAuto": false,
      "since": "2026-09-06",
      "note": "Proposal only. Sonnet 5.5 is the current Sonnet-line target; run paired cases and check access before a pin change."
    },
    {
      "from": "claude-sonnet-4-5",
      "to": "claude-sonnet-5-5",
      "family": "claude-sonnet",
      "vendor": "anthropic",
      "generationOrder": {
        "from": 405,
        "to": 505
      },
      "costClassFrom": "standard",
      "costClassTo": "standard",
      "ladderCompatible": true,
      "contextChange": "unknown",
      "evidence": {
        "kind": "none",
        "reason": "Anthropic names Sonnet 5.5 as the retirement successor. Existing four-case Sonnet 5 comparison cannot transfer to Sonnet 5.5."
      },
      "safeAuto": false,
      "since": "2026-09-06",
      "note": "Proposal only. Sonnet 4.5 snapshot retires 2026-11-30; Anthropic recommends Sonnet 5.5. Re-run identical cases and verify CLI/account access before changing pins."
    },
    {
      "from": "claude-haiku-4-5",
      "to": "claude-haiku-5-5",
      "family": "claude-haiku",
      "vendor": "anthropic",
      "generationOrder": {
        "from": 405,
        "to": 505
      },
      "costClassFrom": "economy",
      "costClassTo": "economy",
      "ladderCompatible": false,
      "contextChange": "increase",
      "evidence": {
        "kind": "none",
        "reason": "No qualifying identical-case local evaluation for Haiku 4.5 and Haiku 5.5; release and vendor claims do not authorize automatic migration."
      },
      "safeAuto": false,
      "since": "2026-10-16",
      "note": "Proposal only. Haiku 5.5 uses a new tokenizer, adaptive thinking, and a 100K prompt-size price boundary. Its operator use is bounded classification/auto-tagging/fixtures; coding floor remains Sonnet low. Review API compatibility and CLI version (v2.1.293 minimum documented) before a pin change."
    },
    {
      "from": "gpt-5.5",
      "to": "gpt-5.6-sol",
      "family": "gpt",
      "vendor": "openai",
      "generationOrder": {
        "from": 50500,
        "to": 50603
      },
      "costClassFrom": "premium",
      "costClassTo": "premium",
      "ladderCompatible": true,
      "contextChange": "unknown",
      "evidence": {
        "kind": "controlledBenchmark",
        "reference": "benchmarks/results/document-to-text/curated-hard-cases-v1/20260810T131256052Z.json",
        "conclusion": "noRegression",
        "summary": "GPT-5.6 Sol passed all four identical document-to-text cases; GPT-5.5 passed three and missed one."
      },
      "safeAuto": true,
      "since": "2026-09-06",
      "note": "Successor within the GPT family; Sol adds ultra to the GPT-5.5 reasoning ladder. The consumer must still resolve a dated target price and current availability before launch."
    },
    {
      "from": "gpt-5.4-mini",
      "to": "gpt-5.4-mini",
      "family": "gpt-mini",
      "vendor": "openai",
      "generationOrder": {
        "from": 50401,
        "to": 50401
      },
      "costClassFrom": "economy",
      "costClassTo": "economy",
      "ladderCompatible": true,
      "contextChange": "same",
      "evidence": "none",
      "safeAuto": false,
      "since": "2026-09-06",
      "note": "Retain GPT-5.4 Mini for bounded pipeline decisions over compact structured evidence; it is not a core-task fallback."
    },
    {
      "from": "gpt-5.6-sol",
      "to": "gpt-6-astra",
      "family": "gpt",
      "vendor": "openai",
      "generationOrder": {
        "from": 50603,
        "to": 60001
      },
      "costClassFrom": "premium",
      "costClassTo": "premium",
      "ladderCompatible": false,
      "contextChange": "unknown",
      "evidence": "none",
      "safeAuto": false,
      "since": "2026-09-06",
      "note": "Proposal only: Astra is supported and has dated premium-class pricing, but changes the reasoning ladder and has no comparable repository no-regression benchmark. External benchmark results do not authorize automatic migration."
    },
    {
      "from": "claude-opus-5",
      "to": "claude-opus-5-5",
      "family": "claude-opus",
      "vendor": "anthropic",
      "generationOrder": {
        "from": 500,
        "to": 505
      },
      "costClassFrom": "premium",
      "costClassTo": "premium",
      "ladderCompatible": true,
      "contextChange": "same",
      "evidence": {
        "kind": "none",
        "reason": "No identical-case benchmark comparing Claude Opus 5 with Claude Opus 5.5 exists yet."
      },
      "safeAuto": false,
      "since": "2026-09-24",
      "note": "Proposal only: Claude Opus 5.5 retains the 1M context window and is ladder-compatible, but no identical-case no-regression benchmark exists. Claude Code 2.1.281 or newer and a dated target price must resolve before an operator-approved launch."
    },
    {
      "from": "gpt-5.6-sol",
      "to": "gpt-6-sol",
      "family": "gpt",
      "vendor": "openai",
      "generationOrder": {
        "from": 50603,
        "to": 60002
      },
      "costClassFrom": "premium",
      "costClassTo": "standard",
      "ladderCompatible": true,
      "contextChange": "unknown",
      "evidence": {
        "kind": "none",
        "reason": "No qualifying identical-case noRegression evidence: TE-57 ran 32 medium fixture attempts, but retained CLI metadata exposed no returned model identity. Requested Sol models and GPT-5.6 Luna passed 6/8 each; requested GPT-6 Luna passed 5/8 including an output-contract failure. Small sample and missing xhigh, max and ultra coverage remain."
      },
      "safeAuto": false,
      "since": "2026-09-24",